{
  "available": true,
  "ticker": "MSFT",
  "as_of": "2026-05-29",
  "schema_version": "v13_single_ticker_statistical_context_envelope",
  "model_stack_version": "yearline_universe_v13.1",
  "series_version": "v13_8_1_yearline_trend_series_v1",
  "n": 180,
  "dates": [
    "2025-09-10",
    "2025-09-11",
    "2025-09-12",
    "2025-09-15",
    "2025-09-16",
    "2025-09-17",
    "2025-09-18",
    "2025-09-19",
    "2025-09-22",
    "2025-09-23",
    "2025-09-24",
    "2025-09-25",
    "2025-09-26",
    "2025-09-29",
    "2025-09-30",
    "2025-10-01",
    "2025-10-02",
    "2025-10-03",
    "2025-10-06",
    "2025-10-07",
    "2025-10-08",
    "2025-10-09",
    "2025-10-10",
    "2025-10-13",
    "2025-10-14",
    "2025-10-15",
    "2025-10-16",
    "2025-10-17",
    "2025-10-20",
    "2025-10-21",
    "2025-10-22",
    "2025-10-23",
    "2025-10-24",
    "2025-10-27",
    "2025-10-28",
    "2025-10-29",
    "2025-10-30",
    "2025-10-31",
    "2025-11-03",
    "2025-11-04",
    "2025-11-05",
    "2025-11-06",
    "2025-11-07",
    "2025-11-10",
    "2025-11-11",
    "2025-11-12",
    "2025-11-13",
    "2025-11-14",
    "2025-11-17",
    "2025-11-18",
    "2025-11-19",
    "2025-11-20",
    "2025-11-21",
    "2025-11-24",
    "2025-11-25",
    "2025-11-26",
    "2025-11-28",
    "2025-12-01",
    "2025-12-02",
    "2025-12-03",
    "2025-12-04",
    "2025-12-05",
    "2025-12-08",
    "2025-12-09",
    "2025-12-10",
    "2025-12-11",
    "2025-12-12",
    "2025-12-15",
    "2025-12-16",
    "2025-12-17",
    "2025-12-18",
    "2025-12-19",
    "2025-12-22",
    "2025-12-23",
    "2025-12-24",
    "2025-12-26",
    "2025-12-29",
    "2025-12-30",
    "2025-12-31",
    "2026-01-02",
    "2026-01-05",
    "2026-01-06",
    "2026-01-07",
    "2026-01-08",
    "2026-01-09",
    "2026-01-12",
    "2026-01-13",
    "2026-01-14",
    "2026-01-15",
    "2026-01-16",
    "2026-01-20",
    "2026-01-21",
    "2026-01-22",
    "2026-01-26",
    "2026-01-27",
    "2026-01-28",
    "2026-01-29",
    "2026-01-30",
    "2026-02-02",
    "2026-02-03",
    "2026-02-04",
    "2026-02-05",
    "2026-02-06",
    "2026-02-09",
    "2026-02-10",
    "2026-02-11",
    "2026-02-12",
    "2026-02-13",
    "2026-02-17",
    "2026-02-18",
    "2026-02-19",
    "2026-02-20",
    "2026-02-23",
    "2026-02-24",
    "2026-02-25",
    "2026-02-26",
    "2026-02-27",
    "2026-03-02",
    "2026-03-03",
    "2026-03-04",
    "2026-03-05",
    "2026-03-06",
    "2026-03-09",
    "2026-03-10",
    "2026-03-11",
    "2026-03-12",
    "2026-03-13",
    "2026-03-16",
    "2026-03-17",
    "2026-03-18",
    "2026-03-19",
    "2026-03-20",
    "2026-03-23",
    "2026-03-24",
    "2026-03-25",
    "2026-03-26",
    "2026-03-27",
    "2026-03-30",
    "2026-03-31",
    "2026-04-01",
    "2026-04-02",
    "2026-04-06",
    "2026-04-07",
    "2026-04-08",
    "2026-04-09",
    "2026-04-10",
    "2026-04-13",
    "2026-04-14",
    "2026-04-15",
    "2026-04-16",
    "2026-04-17",
    "2026-04-20",
    "2026-04-21",
    "2026-04-22",
    "2026-04-23",
    "2026-04-24",
    "2026-04-27",
    "2026-04-28",
    "2026-04-29",
    "2026-04-30",
    "2026-05-01",
    "2026-05-04",
    "2026-05-05",
    "2026-05-06",
    "2026-05-07",
    "2026-05-08",
    "2026-05-11",
    "2026-05-12",
    "2026-05-13",
    "2026-05-14",
    "2026-05-15",
    "2026-05-18",
    "2026-05-19",
    "2026-05-20",
    "2026-05-21",
    "2026-05-22",
    "2026-05-26",
    "2026-05-27",
    "2026-05-28",
    "2026-05-29"
  ],
  "distance_to_ma250_pct": [
    13.9874,
    14.0489,
    15.9817,
    17.1299,
    15.6085,
    15.7489,
    15.308,
    17.37,
    16.4944,
    15.2299,
    15.3502,
    14.5638,
    15.4777,
    16.0926,
    16.7526,
    17.0415,
    16.0411,
    16.2946,
    18.6934,
    17.5386,
    17.6143,
    16.952,
    14.2903,
    14.8779,
    14.6706,
    14.5393,
    14.0329,
    14.3701,
    14.9807,
    15.0698,
    15.6111,
    15.5138,
    16.0855,
    17.7279,
    19.9386,
    19.704,
    16.1148,
    14.2434,
    13.961,
    13.2571,
    11.5812,
    9.2909,
    9.1578,
    11.0902,
    11.5866,
    12.0366,
    10.2374,
    11.6619,
    10.9803,
    7.9078,
    6.3828,
    4.6194,
    3.1833,
    3.5399,
    4.1372,
    5.9391,
    7.292,
    6.0814,
    6.734,
    4.0163,
    4.6509,
    5.1158,
    6.7787,
    6.9503,
    3.9898,
    5.0222,
    3.92,
    3.0867,
    3.4023,
    3.3213,
    4.9816,
    5.3548,
    5.091,
    5.4592,
    5.6651,
    5.5497,
    5.3632,
    5.3855,
    4.4921,
    2.1338,
    2.068,
    3.2418,
    4.2542,
    3.048,
    3.2438,
    2.7356,
    1.2834,
    -1.1769,
    -1.7917,
    -1.1325,
    -2.305,
    -4.5435,
    -3.0389,
    1.0191,
    3.1991,
    3.3868,
    -6.962,
    -7.6654,
    -9.1624,
    -11.7729,
    -11.1365,
    -15.5251,
    -13.9181,
    -11.2476,
    -11.3221,
    -13.2306,
    -13.7692,
    -13.8778,
    -14.8277,
    -14.2308,
    -14.2695,
    -14.5284,
    -17.2622,
    -16.2831,
    -13.7896,
    -13.5576,
    -15.489,
    -14.2484,
    -13.1045,
    -12.8367,
    -11.6707,
    -12.0547,
    -11.9823,
    -12.7882,
    -12.9956,
    -13.6639,
    -15.0268,
    -14.0921,
    -14.2219,
    -15.8634,
    -16.4619,
    -17.9928,
    -17.7451,
    -19.9352,
    -20.2895,
    -21.364,
    -23.3282,
    -22.8486,
    -20.4329,
    -20.5982,
    -19.7212,
    -19.8567,
    -19.9953,
    -19.5724,
    -19.8332,
    -20.3008,
    -17.3988,
    -15.5266,
    -11.6566,
    -9.7544,
    -9.2562,
    -10.3168,
    -9.0573,
    -7.2279,
    -10.9313,
    -9.0589,
    -9.0446,
    -8.1262,
    -9.1764,
    -12.7348,
    -11.2962,
    -11.4571,
    -11.9226,
    -11.358,
    -9.8889,
    -11.0834,
    -11.5852,
    -12.6045,
    -13.1202,
    -12.1845,
    -9.4825,
    -9.1094,
    -10.3935,
    -9.5896,
    -9.7928,
    -9.8829,
    -10.3981,
    -11.0903,
    -7.9829,
    -2.967
  ],
  "drawdown_so_far_pct": [
    0.1175,
    0.1175,
    0.1175,
    0.1175,
    0.1175,
    0.1175,
    0.1175,
    0.1175,
    0.1175,
    0.1175,
    0.1175,
    0.1175,
    0.1175,
    0.1175,
    0.1175,
    0.1175,
    0.1175,
    0.1175,
    0.1175,
    0.1175,
    0.1175,
    0.1175,
    0.1175,
    0.1175,
    0.1175,
    0.1175,
    0.1175,
    0.1175,
    0.1175,
    0.1175,
    0.1175,
    0.1175,
    0.1175,
    0.1175,
    0.1175,
    0.1175,
    0.1175,
    0.1175,
    0.1175,
    0.1175,
    0.1175,
    0.1175,
    0.1175,
    0.1175,
    0.1175,
    0.1175,
    0.1175,
    0.1175,
    0.1175,
    0.1175,
    0.1175,
    0.1175,
    0.1175,
    0.1175,
    0.1175,
    0.1175,
    0.1175,
    0.1175,
    0.1175,
    0.1175,
    0.1175,
    0.1175,
    0.1175,
    0.1175,
    0.1175,
    0.1175,
    0.1175,
    0.1175,
    0.1175,
    0.1175,
    0.1175,
    0.1175,
    0.1175,
    0.1175,
    0.1175,
    0.1175,
    0.1175,
    0.1175,
    0.1175,
    0.1175,
    0.1175,
    0.1175,
    0.1175,
    0.1175,
    0.1175,
    0.1175,
    0.1175,
    0.1175,
    0.1175,
    0.1175,
    0.1175,
    0.1175,
    0.1175,
    3.3094,
    3.3094,
    3.3094,
    9.6427,
    9.6427,
    9.6427,
    12.3168,
    12.3168,
    15.8021,
    15.8021,
    15.8021,
    15.8021,
    15.8021,
    15.8021,
    15.8021,
    15.8021,
    15.8021,
    15.8021,
    15.8021,
    17.5932,
    17.8922,
    17.8922,
    17.8922,
    17.8922,
    17.8922,
    17.8922,
    17.8922,
    17.8922,
    17.8922,
    17.8922,
    17.8922,
    17.8922,
    17.8922,
    17.8922,
    17.8922,
    17.8922,
    17.8922,
    17.8922,
    18.2342,
    18.2342,
    20.0131,
    20.4907,
    21.4457,
    23.3129,
    23.3623,
    23.3623,
    23.3623,
    23.3623,
    23.3623,
    23.3623,
    23.3623,
    23.3623,
    23.3623,
    23.3623,
    23.3623,
    23.3623,
    23.3623,
    23.3623,
    23.3623,
    23.3623,
    23.3623,
    23.3623,
    23.3623,
    23.3623,
    23.3623,
    23.3623,
    23.3623,
    23.3623,
    23.3623,
    23.3623,
    23.3623,
    23.3623,
    23.3623,
    23.3623,
    23.3623,
    23.3623,
    23.3623,
    23.3623,
    23.3623,
    23.3623,
    23.3623,
    23.3623,
    23.3623,
    23.3623,
    23.3623,
    23.3623,
    23.3623
  ],
  "active_engine": [
    "post_confirmation_trend_engine",
    "post_confirmation_trend_engine",
    "post_confirmation_trend_engine",
    "post_confirmation_trend_engine",
    "post_confirmation_trend_engine",
    "post_confirmation_trend_engine",
    "post_confirmation_trend_engine",
    "post_confirmation_trend_engine",
    "post_confirmation_trend_engine",
    "post_confirmation_trend_engine",
    "post_confirmation_trend_engine",
    "post_confirmation_trend_engine",
    "post_confirmation_trend_engine",
    "post_confirmation_trend_engine",
    "post_confirmation_trend_engine",
    "post_confirmation_trend_engine",
    "post_confirmation_trend_engine",
    "post_confirmation_trend_engine",
    "post_confirmation_trend_engine",
    "post_confirmation_trend_engine",
    "post_confirmation_trend_engine",
    "post_confirmation_trend_engine",
    "post_confirmation_trend_engine",
    "post_confirmation_trend_engine",
    "post_confirmation_trend_engine",
    "post_confirmation_trend_engine",
    "post_confirmation_trend_engine",
    "post_confirmation_trend_engine",
    "post_confirmation_trend_engine",
    "post_confirmation_trend_engine",
    "post_confirmation_trend_engine",
    "post_confirmation_trend_engine",
    "post_confirmation_trend_engine",
    "post_confirmation_trend_engine",
    "post_confirmation_trend_engine",
    "post_confirmation_trend_engine",
    "post_confirmation_trend_engine",
    "post_confirmation_trend_engine",
    "post_confirmation_trend_engine",
    "post_confirmation_trend_engine",
    "post_confirmation_trend_engine",
    "post_confirmation_trend_engine",
    "post_confirmation_trend_engine",
    "post_confirmation_trend_engine",
    "post_confirmation_trend_engine",
    "post_confirmation_trend_engine",
    "post_confirmation_trend_engine",